{
  "version": "1.0",
  "generated": "2026-06-02",
  "mission": "Phase 2: Integration Layer Design — Backend↔Forge Mapping",
  "description": "Cross-reference matrix linking backend-manifest → forge-manifest. Maps each forge element to its backend source with effort estimates, wallet context field mapping, connect modal step mapping, loading/error/empty states, gaps analysis, and dependency graph.",
  "prerequisites": {
    "backendManifest": "forge-integration/backend-manifest.json",
    "forgeManifest": "forge-integration/forge-manifest.json"
  },

  "connections": [
    {
      "id": "conn-hero-permit-demo",
      "forgeElement": "Landing page DemoCard — mock portfolio demo cycle",
      "forgeFile": "ui/screens/landing.jsx",
      "forgeSection": "DemoCard",
      "forgeType": "screen-section",
      "backendSource": "LendingPool.getSupplyBalance(), LendingPool.getBorrowBalance(), StrategyVault.getUserPositions()",
      "backendType": "contract-read",
      "backendRef": "lending-pool",
      "effort": "3d",
      "loadingState": "skeleton card with pulsing stat placeholders; demo cycle runs while real data loads",
      "errorState": "fallback to mock demo cycle if contract call fails; inline error banner 'Position data unavailable'",
      "emptyState": "show demo with empty values (0.00) instead of mock values; CTA to connect wallet",
      "fhePath": true,
      "publicPath": false,
      "notes": "DemoCard currently uses hardcoded mock data. Real data requires CoFHE permit unlock. During loading, show the demo animation but label as 'loading sample data'. Needs staggeredReveal pattern for cipher unlock."
    },
    {
      "id": "conn-ticker-stats",
      "forgeElement": "Landing page Ticker — scrolling protocol stats",
      "forgeFile": "ui/screens/landing.jsx",
      "forgeSection": "Ticker",
      "forgeType": "screen-section",
      "backendSource": "GET /stats",
      "backendType": "api",
      "backendRef": "get-stats",
      "effort": "1d",
      "loadingState": "show cached/fallback stats; use last-known values from sessionStorage while fresh data loads",
      "errorState": "keep scrolling ticker with stale data; add error indicator (muted warning icon) if refresh fails",
      "emptyState": "show placeholder stats ('block #—', 'gas · —', etc.) with muted styling",
      "fhePath": false,
      "publicPath": true,
      "notes": "Pure public data endpoint, no encryption needed. Ticker auto-refreshes every 30s. Polling interval configurable."
    },
    {
      "id": "conn-dashboard-positions",
      "forgeElement": "Dashboard positions list — user's on-chain positions",
      "forgeFile": "ui/screens/dashboard.jsx",
      "forgeSection": "Dashboard() — List rail: Positions group",
      "forgeType": "screen-section",
      "backendSource": "LendingPool.getSupplyBalance(), LendingPool.getBorrowBalance(), StrategyVault.getUserPositions() + PriceOracle.convertToUsd()",
      "backendType": "contract-read",
      "backendRef": "lending-pool",
      "effort": "4d",
      "loadingState": "skeleton list items (5 rows with pulsing bars); per-position loading indicator",
      "errorState": "per-position error badge; retry button; 'Position data unavailable' fallback with last-cached data",
      "emptyState": "empty group header 'No positions yet' with CTA to supply or explore strategies",
      "fhePath": true,
      "publicPath": false,
      "notes": "Positions require CoFHE permit to decrypt balances. Supply side is euint128, borrow balance is euint128. Use staggered reveal pattern. Positions include: venue (Lending Pool / Vault), asset, side (supply/borrow/vault), amount (encrypted), APY (public)."
    },
    {
      "id": "conn-dashboard-strategies",
      "forgeElement": "Dashboard strategies list — user's active strategies",
      "forgeFile": "ui/screens/dashboard.jsx",
      "forgeSection": "Dashboard() — List rail: Strategies group",
      "forgeType": "screen-section",
      "backendSource": "GET /defi-strategies?owner={walletAddress}",
      "backendType": "api",
      "backendRef": "get-defi-strategies",
      "effort": "2d",
      "loadingState": "skeleton list items with pulsing; spinner per strategy item",
      "errorState": "error badge on failing items; inline retry; fallback to cached data from sessionStorage",
      "emptyState": "empty group header 'No active strategies' with CTA to Builder workspace",
      "fhePath": false,
      "publicPath": true,
      "notes": "Strategy metadata (name, APY, staked amount, loops, last run) is public data. Encrypted TVL per strategy needs FHE path."
    },
    {
      "id": "conn-dashboard-activity",
      "forgeElement": "Dashboard activity list — recent user activity",
      "forgeFile": "ui/screens/dashboard.jsx",
      "forgeSection": "Dashboard() — List rail: Recent Activity group",
      "forgeType": "screen-section",
      "backendSource": "GET /activities?userAddress={walletAddress}&limit=10",
      "backendType": "api",
      "backendRef": "get-activities",
      "effort": "1.5d",
      "loadingState": "skeleton activity rows; last-cached activities shown with 'refreshing...' indicator",
      "errorState": "inline error per row; 'Activity feed unavailable' banner with retry",
      "emptyState": "empty group 'No recent activity' with CTA to perform first action",
      "fhePath": false,
      "publicPath": true,
      "notes": "Activity events from indexed on-chain data. WebSocket subscription for real-time updates optional. Polling fallback every 15s."
    },
    {
      "id": "conn-dashboard-overview",
      "forgeElement": "Dashboard Overview — stat tiles (Net value, LTV, Permit status, Gas/ETH)",
      "forgeFile": "ui/screens/dashboard.jsx",
      "forgeSection": "Overview",
      "forgeType": "screen-section",
      "backendSource": "LendingPool.getSupplyBalance(), StrategyVault.getUserPositions(), GET /markets/prices",
      "backendType": "contract-read+api",
      "backendRef": "lending-pool",
      "effort": "3d",
      "loadingState": "skeleton stat tiles with pulsing; Cipher components in locked state",
      "errorState": "muted stat value with warning icon; tooltip with error detail",
      "emptyState": "tiles show '—' when no wallet connected or no positions exist",
      "fhePath": true,
      "publicPath": true,
      "notes": "Net value (FHE path: encrypted balances × public oracle prices), LTV (public health factor), Permit status (cofhe SDK), Gas/ETH (public provider balance). Mixed FHE/public path."
    },
    {
      "id": "conn-lending-markets",
      "forgeElement": "Lending screen — market list (5 markets with APY/TVL/util)",
      "forgeFile": "ui/screens/lending.jsx",
      "forgeSection": "Lending() — List rail: markets",
      "forgeType": "screen-section",
      "backendSource": "GET /markets",
      "backendType": "api",
      "backendRef": "get-markets",
      "effort": "1.5d",
      "loadingState": "skeleton market rows with pulsing bars for APY/util/TVL",
      "errorState": "inline error badge per market; stale data with 'last updated X ago' label",
      "emptyState": "empty markets list with 'No markets available' banner (unlikely, but handle graceful)",
      "fhePath": false,
      "publicPath": true,
      "notes": "Market data is all public (supply APY, borrow APY, utilization, TVL, oracle price). No encryption needed. Auto-refresh 30s."
    },
    {
      "id": "conn-lending-action-supply",
      "forgeElement": "Lending screen — supply action (amount input, encrypt, submit)",
      "forgeFile": "ui/screens/lending.jsx",
      "forgeSection": "LendAction — Supply panel",
      "forgeType": "screen-section",
      "backendSource": "LendingPool.shield() / shieldEth()",
      "backendType": "contract-write",
      "backendRef": "lending-pool",
      "effort": "3d",
      "loadingState": "amount input disabled with spinner; 'Encrypting amount…' label; tx pending overlay with tx hash",
      "errorState": "inline error on input (insufficient balance, permit required); tx failure toast with retry; gas estimation failure fallback",
      "emptyState": "amount input empty with placeholder '0.00'; no position state shown as default",
      "fhePath": true,
      "publicPath": false,
      "notes": "Supply requires FHE encryption of amount (InEuint128 via cofhe SDK). User must have active CoFHE permit. Two-step: encrypt with cofhe, then call shield(). shieldEth() for ETH deposits."
    },
    {
      "id": "conn-lending-action-borrow",
      "forgeElement": "Lending screen — borrow action (amount input, LTV slider, submit)",
      "forgeFile": "ui/screens/lending.jsx",
      "forgeSection": "LendAction — Borrow panel",
      "forgeType": "screen-section",
      "backendSource": "LendingPool.borrowWithLtvCheck() or LendingPool.borrowWithOracle()",
      "backendType": "contract-write",
      "backendRef": "lending-pool",
      "effort": "4d",
      "loadingState": "input disabled; LTV gauge pulsing; 'Checking collateral…' overlay; tx pending",
      "errorState": "LTV exceeded warning (destructive color); insufficient collateral error; oracle stale warning",
      "emptyState": "borrow input shows '0.00' with disabled submit until amount entered; no existing borrow shown as default",
      "fhePath": true,
      "publicPath": false,
      "notes": "Borrow requires encrypted amount. LTV check is computed on ciphertext (FHE.lte). borrowWithLtvCheck uses internal FHE LTV calc, borrowWithOracle uses Pyth oracle price for health check. User must have permit."
    },
    {
      "id": "conn-lending-action-repay",
      "forgeElement": "Lending screen — repay action",
      "forgeFile": "ui/screens/lending.jsx",
      "forgeSection": "LendAction — Repay panel (implied)",
      "forgeType": "screen-section",
      "backendSource": "LendingPool.repayDebt()",
      "backendType": "contract-write",
      "backendRef": "lending-pool",
      "effort": "2d",